{
  "from_snapshot_id": "snapshot-a",
  "to_snapshot_id": "snapshot-b",
  "candidates": [
    {
      "candidate_id": "candidate_001",
      "candidate_type": "visual_register_shift",
      "claim_kind": "computed",
      "input_claim_kinds": ["classified"],
      "axis": "visual_register",
      "from": 0.75,
      "to": 0.25,
      "support_count": 4,
      "share_delta": -0.5,
      "strength": "strong",
      "evidence_refs": ["snapshot-a", "snapshot-b", "visual_register:clean_minimal"],
      "coverage_flags": []
    },
    {
      "candidate_id": "candidate_002",
      "candidate_type": "visual_register_shift",
      "claim_kind": "computed",
      "input_claim_kinds": ["classified"],
      "axis": "visual_register",
      "from": 0.25,
      "to": 0.75,
      "support_count": 4,
      "share_delta": 0.5,
      "strength": "strong",
      "evidence_refs": ["snapshot-a", "snapshot-b", "visual_register:raw_authentic"],
      "coverage_flags": []
    }
  ],
  "coverage_flags": []
}

