{
  "from_snapshot_id": "snapshot-a",
  "to_snapshot_id": "snapshot-b",
  "candidates": [
    {
      "candidate_id": "candidate_001",
      "candidate_type": "appeal_shift",
      "claim_kind": "computed",
      "input_claim_kinds": ["classified"],
      "axis": "appeal",
      "from": 1,
      "to": 0,
      "support_count": 2,
      "share_delta": -1,
      "strength": "medium",
      "evidence_refs": ["snapshot-a", "snapshot-b", "appeal:price"],
      "coverage_flags": ["appeal includes low-confidence classified reads — strength capped below strong"]
    }
  ],
  "coverage_flags": []
}

