{
  "from_snapshot_id": "snapshot-a",
  "to_snapshot_id": "snapshot-b",
  "candidates": [
    {
      "candidate_id": "candidate_001",
      "candidate_type": "appeal_shift",
      "claim_kind": "computed",
      "input_claim_kinds": ["classified"],
      "axis": "appeal",
      "from": 0.3333,
      "to": 1,
      "support_count": 4,
      "share_delta": 0.6667,
      "strength": "strong",
      "evidence_refs": ["snapshot-a", "snapshot-b", "appeal:social_proof"],
      "coverage_flags": []
    }
  ],
  "coverage_flags": []
}

